rank_by_posts,normalized_issue_label,provisional_label,short_description,total_num_posts,num_courses,num_clusters,global_cluster_id
1,assessment_material_misalignment,Practice and study materials misaligned with assessments,"Course practice materials, PAs, study guides, and other learning resources are not aligned with the Objective Assessment (content, question styles, or difficulty), leaving students unprepared.",36,13,13,G001
2,unclear_or_ambiguous_instructions,Unclear or ambiguous instructions and rubrics,"Assignment and submission instructions or rubrics lack clarity or consistency (what to submit, formats, examples), causing students to be unsure how to meet requirements.",24,7,7,G002
3,assessment_material_misalignment,Assessments not aligned with taught materials,"Assessments (PA/OA/labs/quizzes) contain topics, wording, or formats not reflected in course materials or practice, leaving students unprepared.",17,9,10,G003
4,platform_or_environment_failures,"Platform, environment, or system failures","Technical platform or environment problems (lab/VM misconfigurations, autograder or backend bugs, auth/access errors, missing reports) cause student work to fail or block access.",15,5,6,G004
5,unclear_or_ambiguous_instructions,Unclear or ambiguous instructions and expectations,"Assignment and submission instructions, rubrics, or prompt details are vague, contradictory, or hard to find, leaving students uncertain how to complete or submit work.",12,11,12,G006
6,unclear_or_ambiguous_instructions,Ambiguous or incomplete instructions,"Assignment, task, or platform instructions are unclear, incomplete, or contradictory (including navigation and format changes), causing confusion about required deliverables.",12,7,7,G005
7,unclear_or_ambiguous_instructions,Ambiguous or unclear instructions and rubrics,"Instructions, rubrics, or assignment directions are vague, contradictory, or incomplete (format, scope, citation, wording, acronyms), causing submission rejections or confusion.",11,10,11,G007
8,assessment_material_misalignment,Assessments not aligned with taught materials or each other,"Assessments (OA/PA/quizzes/pretests) include content, versions, or platform-specific details that are not covered by course lessons, are inconsistent across versions, or conflict with learning objectives, leaving students unprepared.",10,10,10,G008
9,assessment_material_misalignment,Assessment items misaligned with taught material or industry/current versions,"Assessment content (OAs, PAs, proctored exams, or software versions) does not match study guides, course materials, or current industry expectations.",9,8,9,G009
10,missing_or_low_quality_materials,"Missing, outdated, or low-quality course materials","Essential instructional materials are missing, outdated, or of poor quality (removed videos, obsolete screenshots, confusing text), reducing students' ability to learn or complete assignments.",9,4,4,G010
11,missing_or_low_quality_materials,Low‑quality or missing instructional materials,"Course content (readings, examples, templates, lectures) is missing, poorly organized, or lacks practical/scenario examples and useful templates.",8,5,5,G011
12,assessment_material_misalignment,assessment_material_misalignment,"Course/practice materials, quizzes, or pre-assessments are inconsistent with Objective or Proctored Assessments (scope, format, or answer options), causing students to be underprepared or study the wrong content.",7,7,7,G016
13,unclear_or_ambiguous_instructions,Ambiguous assignment & submission instructions,"Assignment prompts, submission instructions, and expectation documents are vague, conflicting, or missing required detail, causing students to be unsure what to submit or how to meet requirements.",7,6,7,G012
14,missing_or_low_quality_materials,"Missing, disorganized, or low‑quality learning materials","Course readings, videos, guides, or supplemental resources are missing, scattered, poorly written, too simple, or insufficiently scaffolded, causing students to seek external resources or remain unprepared.",7,5,7,G015
15,missing_or_broken_resources,Broken or inaccessible course resources,"Broken links, inaccessible platforms, missing starter files, or unusable lab access prevent students from locating or using required resources.",7,4,4,G013
16,evaluator_inconsistency_or_poor_feedback,Inconsistent or unhelpful evaluator feedback,"Evaluators provide vague, contradictory, or incorrect feedback and expectations, or conflict with course materials, forcing repeated revisions and confusion.",7,2,3,G014
17,assessment_material_misalignment,Assessments misaligned with course materials,"Objective assessments, pretests, or questions do not match taught content or study materials (including excessive memorization or missing PBQs), leaving students unprepared for evaluations.",6,6,6,G017
18,evaluator_inconsistency_or_poor_feedback,Inconsistent evaluators / poor feedback,"Instructors/evaluators apply rubrics inconsistently or give insufficient/conflicting feedback, making resubmissions and corrections unclear.",6,4,4,G018
19,assessment_material_misalignment,Assessment (PA/OA) material misalignment,"Objective assessments, performance assessments, or final exams include content, objectives, or requirements not reflected in course materials, unit tests, or stated expectations.",5,5,5,G019
20,missing_or_low_quality_materials,Missing or low-quality course materials,"Required materials are missing, poorly formatted, too brief, factually incorrect, or otherwise insufficient for learning and exam preparation.",5,5,5,G021
21,missing_or_low_quality_materials,Outdated or poor-quality course materials,"Learning materials, examples, templates, or files are outdated, incompatible, incomplete, or of low quality, reducing their usefulness for student learning and task completion.",5,5,5,G022
22,platform_or_environment_failures,Platform or lab environment failures,"Platform, testing, or lab environments are unstable, inaccessible, or experiencing outages/errors that prevent completing assessments or accessing materials.",5,5,5,G023
23,platform_or_environment_failures,"Platform, system, or environment failures","Platform, assessment, or lab systems exhibit access issues, bugs, slow/unresponsive behavior, or reporting errors that block or disrupt student progress.",5,5,5,G025
24,unclear_or_ambiguous_instructions,Unclear or ambiguous instructions in assessments and labs,"Questions, practice items, lab steps, or deliverable requirements are vague, contradictory, or poorly worded, preventing correct student interpretation.",5,5,5,G029
25,missing_or_broken_resources,missing_or_broken_resources,"Required course files, study guides, links, or platform resources are missing, empty, or broken, with no timely repair or clear workaround.",5,5,5,G030
26,unclear_or_ambiguous_instructions,unclear_or_ambiguous_instructions,"Assignment or submission instructions and task guidance are ambiguous or inconsistent (including file-type/link expectations and unclear question directions), leaving students unsure how to comply.",5,5,5,G031
27,evaluator_inconsistency_or_poor_feedback,Evaluator inconsistency or poor feedback,"Assessors provide unclear, inconsistent, or misapplied feedback and grading (including unexplained or seemingly unreviewed decisions) that block student progress or require unnecessary revisions.",5,4,5,G020
28,workflow_or_policy_barriers,Policy or remediation workflows that block progress,"Course or instructor policies (remediation gating, approval requirements, verification burdens) are onerous, inconsistent, or impede timely progress.",5,4,5,G026
29,tooling_environment_misconfiguration_or_guidance,Tooling/environment configuration & guidance gaps,"Course or platform tooling (lab envs, evaluators, starter files) are misconfigured or lack clear setup/guidance, causing student work to fail or behave differently across environments.",5,4,5,G028
30,platform_or_environment_failures,"Platform, submission, or exam environment failures","Technical problems, UI/layout issues, or submission/exam system failures (including recording/term misattribution) prevent access, completion, or proper submission of assessments.",5,3,5,G024
31,tooling_environment_misconfiguration_or_guidance,Tooling/configuration and guidance problems,"Tooling, environment configuration, or provided guidance is incorrect or insufficient (auth connector mismatches, unclear autograder expectations), causing runtime failures or incorrect grading.",5,2,2,G027
32,assessment_material_misalignment,Assessment materials misaligned with learning activities,"Pre‑assessments, study materials, rubrics, or OAs do not align with the content or tasks students are given, producing unexpected or unfair assessment outcomes.",4,4,4,G032
33,missing_or_broken_resources,"Missing or broken provided resources (code, assets, links)","Required course assets, starter code, or third‑party links are missing, broken, or contain bugs that prevent students from completing tasks as instructed.",4,4,4,G035
34,missing_or_broken_resources,Missing or broken required resources,"Required cohort materials, pre-recorded resources, labs, or resource lists are missing, inaccessible, incorrect, or otherwise unusable, preventing assessment completion.",4,4,4,G036
35,missing_or_low_quality_materials,Missing or low‑quality instructional materials,"Course materials lack essential content (definitions, templates, exemplars) or include low‑quality data/resources, forcing students to seek external help or make assumptions.",4,4,4,G037
36,platform_or_environment_failures,Platform or environment failures,"System outages, loading errors, or platform reliability issues (including recording/playback failures) prevent access to lessons, tools, or required assessments.",4,4,4,G038
37,workflow_or_policy_barriers,"Workflow, policy, or process barriers","Course workflows or administrative policies (peer-review dependencies, transfer/credit processing, remediation rules) create blocking or inflexible barriers to student progress.",4,3,4,G039
38,platform_or_environment_failures,platform_or_environment_failures,"Technical failures or platform errors (assessment scheduling/status, result processing, recording tools, or file/feature loading) prevent students from completing or recording required work.",4,3,4,G040
39,grading_or_answer_key_or_process_issues,Automated grading and answer-key failures,Automated graders or validation processes incorrectly mark correct solutions wrong or fail to detect valid inputs across platforms.,4,2,2,G033
40,tooling_environment_misconfiguration_or_guidance,Environment/tooling configuration and guidance gaps,"Required runtime/tool versions, CI/evaluator environment details, and troubleshooting guidance are undocumented or insufficient.",4,1,2,G034
41,unclear_or_ambiguous_instructions,Ambiguous or poorly worded instructions and questions,"Task instructions, assessment prompts, or lesson wording are vague, ambiguous, or overly picky, requiring clarification and causing inconsistent student responses.",3,3,3,G041
42,evaluator_inconsistency_or_poor_feedback,Evaluator inconsistency and unhelpful feedback,"Graders/evaluators provide conflicting, slow, or non-actionable feedback, or misapply rubrics leading to unclear next steps for remediation.",3,3,3,G042
43,evaluator_inconsistency_or_poor_feedback,Inconsistent or unhelpful grading and feedback,"Rubrics are applied inconsistently or rigidly, feedback is vague or demands verbatim responses, and returned work lacks actionable guidance.",3,3,3,G044
44,missing_or_low_quality_materials,Low-quality or insufficient instructional materials,"Course content and supplementary materials are low-quality, inconsistent, overly theoretical, or missing needed practical examples/support for the PA.",3,3,3,G046
45,missing_or_broken_resources,Missing or broken course assets/resources,"Essential assets, templates, or provided data files are missing, malformed, or broken, directly blocking students from completing work.",3,3,3,G047
46,missing_or_broken_resources,Missing or broken referenced resources,"Referenced labs, templates, or assessment items are absent or nonfunctional (broken items, missing ZyBooks labs), blocking students from completing work.",3,3,3,G048
47,platform_or_environment_failures,"Platform, CI, or deployment failures","Pipelines, hosting, learning platforms, or content delivery systems fail or produce stale/missing artifacts, preventing students from accessing or publishing required work.",3,3,3,G049
48,evaluator_inconsistency_or_poor_feedback,evaluator_inconsistency_or_poor_feedback,"Evaluators apply rubrics inconsistently or provide vague, non-actionable feedback, leading to unexpected returns and unclear revision guidance.",3,3,3,G051
49,missing_or_low_quality_materials,missing_or_low_quality_materials,"Course texts or materials are outdated, poorly written, or disorganized, reducing usability and learning effectiveness.",3,3,3,G053
50,workload_or_scope_issues,workload_or_scope_issues,"Assessment design or course structure imposes excessive scope or repetitive/time-consuming tasks (fragmented long content, excessive required materials, or mandatory multiple recorded presentations).",3,3,3,G054
51,instructor_or_support_unresponsiveness,Unreliable instructor/evaluator support or response,"Support personnel or evaluators are unavailable, miss scheduled help, or fail to communicate/timely grade, leaving students without needed assistance or clarity.",3,2,3,G050
52,instructor_or_support_unresponsiveness,instructor_or_support_unresponsiveness,"Course or assessment support teams fail to provide required credentials, interventions, or timely responses (including Assessment Services follow-up), delaying student progress.",3,2,3,G052
53,grading_or_answer_key_or_process_issues,"Grading, answer-key, or process errors","Correct student work is marked incorrect due to outdated/incorrect answer keys, grader errors, or grading process issues.",3,1,1,G043
54,instructor_or_support_unresponsiveness,Instructor or support unresponsiveness,"Course instructors, approvers, or support staff are slow or unresponsive to student requests (retake approvals, questions), causing missed deadlines or blocked progress.",3,1,1,G045
55,grading_or_answer_key_or_process_issues,"Answer key, grading rules, or automated grading issues","Incorrect/outdated answer keys, unclear machine‑grading rules, or grading process errors mark correct work wrong or leave expectations unspecified.",2,2,2,G056
56,proctoring_or_exam_platform_issues,Exam/proctoring platform reliability issues,Proctoring or exam/browser platforms experience access or rendering failures that block or delay students during assessments.,2,2,2,G058
57,workload_or_scope_issues,Excessive course scope or redundant remediation,"Course scope or remediation expectations are oversized or redundant (e.g., combining multiple course levels or requiring excessive rework), making assessments unmanageably large.",2,2,2,G059
58,instructor_or_support_unresponsiveness,Instructor or course support unresponsiveness,"Instructors, course staff, or tutoring resources are unresponsive, unhelpful, or unavailable for course-specific questions and support.",2,2,2,G062
59,missing_or_low_quality_materials,Insufficient or low-quality instructional materials,"Courses lack sufficient or diverse instructional content (e.g., only a textbook or short welcome, no videos or guided materials), reducing available learning resources.",2,2,2,G064
60,workflow_or_policy_barriers,Policy or workflow requirements that block progression,"Course policies or mentor-imposed requirements (extra homework, onerous remediation) are misaligned with program/self-paced expectations and create barriers to progression.",2,2,2,G066
61,external_tool_dependency_risks,Risks from external tool or API dependencies,"Course tasks rely on external services or APIs that are unreliable, incomplete, or behave inconsistently, and the course lacks guidance or workarounds.",2,2,2,G068
62,scheduling_or_simulation_availability_issues,Scheduling or simulation availability issues,Mandatory simulations or proctored activities have no available time slots or suffer availability constraints that prevent students from completing required components.,2,2,2,G069
63,tooling_environment_misconfiguration_or_guidance,Tooling or VM misconfiguration and guidance gaps,"VMs, content mappings, or platform tooling are misconfigured or lack clear configuration guidance (score display, VM locations, mappings).",2,2,2,G070
64,tooling_environment_misconfiguration_or_guidance,Tooling/environment configuration or missing guidance,"Missing instructions, configuration guidance, or troubleshooting steps for required tools/platforms leave students unsure what evidence is acceptable or how to resolve tool failures.",2,2,2,G071
65,unclear_or_ambiguous_instructions,Unclear or ambiguous instructions and questions,"Assessment items and assignment directions are ambiguously worded (unclear objective questions; ambiguous burn down chart instructions), causing inconsistent interpretations.",2,2,2,G072
66,workflow_or_policy_barriers,Workflow or policy barriers,"Course policies or administrative processes (e.g., locked submissions, missing proctor confirmations) create blockers that require staff intervention to proceed.",2,2,2,G073
67,workflow_or_policy_barriers,Workflow or policy barriers (scheduling & degree plan issues),"Administrative workflows, degree-plan assignment, or required syllabus/pacing elements are missing or blocked by policy/process constraints, preventing necessary course setup or external requirements.",2,2,2,G074
68,proctoring_or_exam_platform_issues,proctoring_or_exam_platform_issues,"Proctoring policies or proctoring platform/connectivity issues (rigid identity/room checks, proctor inability to see video) interrupt exams or create confusion.",2,2,2,G075
69,tooling_environment_misconfiguration_or_guidance,tooling_environment_misconfiguration_or_guidance,"Course tooling or simulation settings and guidance are misconfigured or undocumented (presentation tool conflicts, unclear simulation auto-population), causing student uncertainty about correct use.",2,2,2,G076
70,ai_detection_confusion_and_false_flags,AI/similarity detection tool confusion,Similarity and AI-detection tools produce inconsistent or non-transparent outputs and students lack guidance on how results are used.,2,1,1,G055
71,proctoring_or_exam_platform_issues,Exam/proctoring platform or scheduling failures,Problems with exam/proctoring platforms or scheduled launches prevent students from accessing or completing proctored assessments.,2,1,1,G057
72,external_tool_dependency_risks,External platform / repo dependencies causing failures,"Dependencies on external tools (e.g., GitLab repos, forks, starter code) or their setup cause access and submission failures without course-side mitigation.",2,1,1,G060
73,external_tool_dependency_risks,External tool compatibility and dependency risks,"Course-provided files or external dependencies (e.g., Excel macros) create compatibility, antivirus, or runtime issues on student systems.",2,1,1,G061
74,instructor_or_support_unresponsiveness,Instructor/mentor communication failures,"Mentors or instructors fail to inform students about assessment format changes or course updates, leaving students unaware of requirements or changes.",2,1,2,G063
75,tooling_environment_misconfiguration_or_guidance,Outdated/incompatible tooling or missing setup guidance,"Course VMs, connectors, or required tools are outdated/incompatible or depend on disabled legacy settings, and no setup guidance or updated resources are provided.",2,1,2,G065
76,proctoring_or_exam_platform_issues,Proctoring and exam platform reliability,"Proctoring platform and pre-exam checks are unreliable (queues, false network checks), preventing or delaying exam starts.",2,1,1,G067
77,ai_detection_confusion_and_false_flags,AI-detection flags and lack of guidance,AI-detection tools flag student work without guidance on acceptable tools or how to resolve false positives.,1,1,1,G077
78,grading_or_answer_key_or_process_issues,"Answer key, dataset, or grading process errors","Provided datasets, expected results, or answer keys are incorrect or misaligned with task instructions, causing grading mismatches.",1,1,1,G078
79,external_tool_dependency_risks,External tool dependency causing performance/compatibility issues,"Third‑party simulation (Labster) generates severe local performance problems (high CPU), rendering the activity unusable on some student machines.",1,1,1,G079
80,grading_or_answer_key_or_process_issues,"Grading, answer key, or rubric process issues","Rubric wording or assessor guidance is incorrect or misleading (e.g., variables misclassified), causing grading errors or misapplication of criteria.",1,1,1,G080
81,instructor_or_support_unresponsiveness,Instructor/support responsiveness issues,"Instructors or course support are unresponsive or slow to act on time-sensitive requests (e.g., retake approvals).",1,1,1,G081
82,evaluator_inconsistency_or_poor_feedback,Insufficient or non-actionable evaluator feedback,"Instructors/evaluators provide generic, non‑targeted feedback or remediation instead of actionable explanations to correct student mistakes.",1,1,1,G082
83,external_tool_dependency_risks,Mandatory third‑party platform dependency,"Course access or key activities require a third‑party platform, creating integration or access barriers for students.",1,1,1,G083
84,missing_or_broken_resources,Missing required templates or assessment resources,"Required course assets (performance assessment templates/materials) are absent from the course, preventing correct submissions.",1,1,1,G084
85,workflow_or_policy_barriers,Policy/process barriers (retakes & requirements),"Inconsistent or changing policies and process requirements (retakes, post‑submission rules) create barriers and delays.",1,1,1,G085
86,prerequisite_gaps_or_unpreparedness,Prerequisite knowledge gaps,"Course assumes prior skills or knowledge that were not taught, creating gaps between prerequisites and current lessons.",1,1,1,G086
87,proctoring_or_exam_platform_issues,Proctoring and exam platform interruptions,"Proctoring or exam platforms terminate, redirect, or behave incorrectly during tests, causing lost time, missing scores, or inability to review results.",1,1,1,G087
88,proctoring_or_exam_platform_issues,Proctoring conduct and administration problems,Inconsistent or unprofessional proctor behavior and insufficient proctor training/monitoring lead to problematic exam administration.,1,1,1,G088
89,proctoring_or_exam_platform_issues,Proctoring interruptions and exam platform time loss,"Proctoring or exam platform interruptions consume exam time, force reconnections, and create time pressure or guesswork during assessments.",1,1,1,G089
90,proctoring_or_exam_platform_issues,Proctoring rules and exam platform burdens,"Proctoring requirements are unclear or overly burdensome (e.g., multiple camera views) and create risk of test cancellation or access problems.",1,1,1,G090
91,scheduling_or_simulation_availability_issues,Required synchronous sessions with limited availability,"Mandatory scheduled/synchronous sessions are offered in limited time slots, creating access problems for students with work or family commitments.",1,1,1,G091
92,scheduling_or_simulation_availability_issues,Scheduling or simulation facilitator availability issues,"Scheduled simulations or facilitator/virtual avatar sessions are late, absent, or otherwise unavailable, wasting student appointment time.",1,1,1,G092
93,ai_detection_confusion_and_false_flags,Similarity/plagiarism detection false positives or unclear configuration,Similarity/plagiarism checks generate high similarity scores without clear configuration or guidance to prevent false positives for students.,1,1,1,G093
94,external_tool_dependency_risks,Third‑party tool bugs and dependency risks,"Bugs or conflicting behavior in third‑party content (e.g., Zybooks) force workarounds or incorrect student outputs to pass assessments.",1,1,1,G094
95,evaluator_inconsistency_or_poor_feedback,Unclear rubric or assessor expectations causing rework,"Rubrics or assessor expectations are unclear or misaligned with submitted evidence, leading to inconsistent evaluation and repeated revisions.",1,1,1,G095
96,instructor_or_support_unresponsiveness,Unresponsive instructor or lack of escalation path,Instructors or course support do not respond after failed assessments and there is no clear SLA or escalation contact.,1,1,1,G096
97,prerequisite_gaps_or_unpreparedness,Unscaffolded expectations for students without prerequisites,Assignments assume prior knowledge or experience without scaffolding or preparatory instruction for novices.,1,1,1,G097
98,ai_detection_confusion_and_false_flags,ai_detection_confusion_and_false_flags,Similarity/AI-detection tools are matching against inappropriate/shared student submission data or producing persistent false positives without clear mitigation or configuration explanation.,1,1,1,G098
99,grading_or_answer_key_or_process_issues,grading_or_answer_key_or_process_issues,"Automated assessment or grading processes fail to provide adequate item-level feedback or clear indications of incorrect items, limiting students' ability to learn from results.",1,1,1,G099
100,workflow_or_policy_barriers,workflow_or_policy_barriers,Course/platform enforces undocumented sequencing or approval locks and other policy-based barriers that block progress without clear documentation or exception paths.,1,1,1,G100
